music therapist,"Music therapists use musictherapeutic interventions to treat patients with behavioural disorders and pathogenic conditions to prevent mitigate or eliminate symptoms and to change behaviours and attitudes requiring treatment They promote and maintain or restore the development maturity and health of the patientclient by musictherapeutic interventions Music therapy especially provides help for people with with emotional somatic intellectually or socially induced behavioural disorders and pathogenic conditions such as psychoses schizophrenic disorders bipolar disorders and personality development disorders 
 "
dentistry lecturer,Dentistry lecturers are subject professors teachers or lecturers and often doctors who instruct students who have obtained an upper secondary education diploma in their own specialised field of study dentistry which is predominantly academic in nature They work with their university research assistants and university teaching assistants for the preparation of lectures and of exams for grading papers and exams for leading laboratory practices and for leading review and feedback sessions for the students They also conduct academic research in their respective field of dentistry publish their findings and liaise with other university colleagues
coffee taster,Coffee tasters taste coffee samples in order to evaluate the features of the product or to prepare blending formulas They determine the products grade estimate its market value and explore how these products may appeal to different consumer tastes They write blending formulas for workers who prepare coffee products for commercial purposes
laundry ironer,Laundry ironers reshape clothing items and linen and remove creases from them by using irons presses and steamers They clean and maintain the ironing and drying area and organise the items accordingly
airport baggage handler,Airport baggage handlers receive and return the luggage of passengers at airport terminals They prepare and attach baggage claim checks stack baggage on carts or conveyors and may return baggage to patrons on receipt of claim check
leather production machine operator,Leather production machine operators use the tannery machinery and programs according to the specific requirements to achieve the departments standards They do routine maintenance of the machinery
research engineer,Research engineers combine research skills and knowledge of engineering principles aiming to improve through research processes techniques products and systems at large They perform experiments for instance of natural structures such as honeycombs or tearresistant spiderwebs before determining the viability of alternative methods on a larger scale
business administration vocational teacher,Business administration vocational teachers for business administration instruct students in their specialised field of study business administration which is predominantly practical in nature They provide theoretical instruction in service of the practical skills and techniques the students must subsequently master for a business administrationrelated profession such as accountant or banker Business administration vocational teachers monitor the students progress assist individually when necessary and evaluate their knowledge and performance on the subject of business administration through assignments tests and examinations
climatologist,Climatologists study the average change in weather and climate from a longterm perspective They research and analyse historic weather conditions in order to forecast climatic conditions trends such as changes in temperature global warming or regional evolutive weather conditions They use these findings for advising on environmental policy construction agricultural projects and societal matters
bathroom fitter,Bathroom fitters install bathroom elements They take the necessary measurements prepare the room removing old elements if necessary and install the new bathroom equipment including the connection of water gas and sewage pipes and electricity lines
leather goods machine operator,Leather goods machine operators tend specific machines in the industrial production of leather goods products They operate machinery for cutting closing and finishing luggage handbags saddlery and harness products They also perform routine maintenance of the machinery
corporate treasurer,Corporate treasurers determine and oversee the financial strategic policies of a company or organisation They use cash management techniques like account organisation cash flow monitoring liquidity planning and control risk management including currency and commodity risks and maintain close connection with banks and rating agencies
political campaign officer,Political campaign officers provide support during political campaigns advising the candidate and campaign management staff on campaign strategies and campaign staff coordination as well as developing advertising and research strategies
electrical equipment assembler,Electrical equipment assemblers are responsible for the assembly of electrical equipment They assemble product components and wiring according to the blueprints
incinerator operator,Incinerator operators tend incineration machines which burn refuse and waste They ensure the equipment is maintained and that the incineration process occurs in accordance with safety regulations for the incineration of waste
Pilates teacher,Pilates teachers plan teach and adapt exercises based on the work and principles of Joseph Pilates They collect and analyse information for each client to ensure that programmes are safe appropriate and effective They apply the principles of Pilates through the planning and teaching of supportive noncompetitive lesson They motivate and encourage clients to ensure their adherence to regular sessions
ICT technician,ICT technicians install maintain repair and operate information systems and any ICT related equipment laptops desktops servers tablets smart phones communications equipment printers and any piece of computer related peripheral networks and any type of software drivers operating systems applications
sports coach,Sports coaches provide instruction in the sport of their specialisation in a recreational context to nonagespecific and age specific participants They identify already acquired skills and implement suitable training programmes for the groups or individuals they teach in order to develop participants physical and psychological fitness They create the most optimal environment for the growth of participant skills and enable them to maximise their performance while fostering good sportsmanship and character in all participants Sports coaches also track the participant progress and provide personalised instruction where needed They supervise sports facilities and changing rooms and maintain uniforms and equipment
stone planer,Stone planers operate and maintain planing machines that are used for stone blocks and slabs finishing They manipulate the stone and ensure that the required parameters are according to specifications
"wholesale merchant in hides, skins and leather products",Wholesale merchants in hides skins and leather products investigate potential wholesale buyers and suppliers and match their needs They conclude trades involving large quantities of goods
mortgage broker,Mortgage brokers handle mortgage loan applications from clients collect loan documentation and search for new mortgage lending opportunities They complete and close mortgage loan processes for their clients
import export specialist in flowers and plants,Import export specialists in flowers and plants have and apply deep knowledge of import and export goods including customs clearance and documentation
lottery cashier,Lottery cashiers exchange the registration of set of numbers or symbols for money and give tickets to the players They pay out prizes and obtain customers signatures and identification They audit and count money in the cash register enforcing regulations to prevent money laundering
rail project engineer,Rail project engineers maintain a safe costeffective highquality and environmentally responsible approach across the technical projects in railway companies They provide project management advice on all construction projects including testing commissioning and site supervision They audit contractors for safety environment and quality of design process and performance as to ensure that all projects follow inhouse standards and relevant legislation
construction safety manager,Construction safety managers inspect enforce and control health and safety measures at construction sites They also manage workplace accidents and take action to make sure that safety policies are correctly implemented
court administrator,Court administrators perform managerial tasks in a court institution such as supervision of staff administration communicating with judges and reviewing procedures They also manage the courts finances and oversee maintenance of the facility and equipment
rolling stock engineering drafter,Rolling stock engineering drafters convert the rolling stock engineers designs into technical drawings usually using software Their drawings detail dimensions fastening and assembling methods and other specifications used in the manufacture of rail vehicles such as locomotives multiple units carriages and wagons
child day care worker,Child day care workers provide social services to children and their families in order to improve their social and psychological functioning They aim to maximise familys wellbeing by caring of children during the day
toxicologist,Toxicologists study the effects that chemical substances or biological and physical agents have in living organisms more specifically on the environment and on the animal and human health They determine doses of the exposure to substances for arising toxic effects in environments people and living organisms and also perform experiments on animals and cell cultures
drilling engineer,Drilling engineers develop and supervise the drilling of gas and oil wells They assist in the designing testing and creation of wells and are employed on land or offshore platforms Drilling engineers work with other mining professionals and oversee the drilling progress and safety of the site
humanitarian advisor,Humanitarian advisors ensure strategies to reduce the impact of humanitarian crises on a national andor international level They provide professional advice and support and this in collaboration with different partners
footwear CAD patternmaker,Footwear CAD patternmakers design adjust and modify patterns for all kinds of footwear using CAD systems They check laying variants using nesting modules of the CAD system and material consumption Once the sample model has been approved for production these professionals make series of patterns grading to produce a range of the same footwear model in different sizes
"computer games, multimedia and software specialised seller",Computer games multimedia and software specialised sellers sell software products in specialised shops
sewerage maintenance technician,Sewerage maintenance technicians inspect sewers and pipeline systems They do this by using moving video cameras whose recordings tell them whether they need to perform any maintenance and repair on these types of systems
mediator,"
Mediators resolve disputes between two parties by examining the case interviewing both parties and advising on a solution which would be the most beneficial for them They listen to both parties in order to facilitate communication and find a fair agreement and organise meetings They aim at resolving disputes through dialogue and alternative solution without having to take the case to litigation and courts Mediators ensure that the resolution is compliant with legal regulations and is also enforced"
government minister,Government ministers function as decisionmakers in national or regional governments and head government ministries They perform legislative duties and supervise the operation of their department
production supervisor,Production supervisors coordinate plan and direct manufacturing and production processes They are responsible for reviewing production schedules or orders as well as dealing with staff in these production areas
explosives engineer,Explosives engineers design drilling patterns and determine the amount of explosives required They organise and supervise controlled blasts and report and investigate misfires They manage explosives magazines
body artist,Body artists decorate clients skin temporarily or permanently They use various techniques such as tattooing or piercing Body artists follow clients preferences in terms of tattoos or piercings design and body surface and apply it safely They also advise on methods to avoid infection following the procedures on clients bodies
bleacher operator,Bleacher operators tend a machine that bleaches wood pulp to serve in the production of white paper Different bleaching techniques are used to complement the various pulping methods and to obtain different grades of whiteness
network marketer,Network marketers apply various marketing strategies including network marketing strategies to sell products and convince new people to also join in and start selling these products They use personal relations to attract customers and sell various types of products
decorative painter,Decorative painters design and create visual art on different kinds of surfaces such as pottery casings glass and fabric They use diverse materials and a variety of techniques to produce decorative illustrations ranging from stenciling to freehand drawing
ceiling installer,Ceiling installers install ceilings in buildings They apply different techniques as the situation requires  for example when fire resistance is especially important or when space is needed between the dropped ceiling and the next floor  or specialise in one
fuel station specialised seller,Fuel station specialised sellers sell fuel lubricating and cooling products for motor vehicles and motorcycles in a fuel station
derrickhand,Derrickhands guide the positions and movements of drill pipes They control the automated pipehandling equipment They are often responsible for the condition of drilling fluids or mud
corrosion technician,Corrosion technicians monitor the integrity from a pipeline and provide repairs to it if needed They ensure that the pipelines are properly connected and are in line with the health and safety regulations Corrosion technicians inspect cathodic protection systems and pipeline connection points for corrosion They may also assist in the designing of pipelines analyse soil and write reports on technical issues
product development engineering technician,Product development engineering technicians improve efficiency of product development set up equipment and develop and test solutions to solve technical problems They work closely with engineers and technologists inspect products conduct tests and collect data
marine upholsterer,Marine upholsterers manufacture assemble and repair interior components for all types of boats They use power tools hand tools and shop equipment to prepare and fasten materials and apply finishes They also inspect incoming materials and prepare the boat interior for new components
destination manager,Destination managers are in charge of managing and implementing the nationalregionallocal tourism strategies or policies for destination development marketing and promotion
underground heavy equipment operator,Underground heavy equipment operators control heavyduty mining equipment such as cutting and loading equipment to excavate and load ore and raw mineral at underground mines
grader operator,Grader operators work with a heavy piece of mobile equipment that creates a flat surface by slicing off the top soil with a large blade Graders usually provide a flat finish on the heavy earthmoving work performed by the scraper and bulldozer operators
employment agent,Employment agents work for employment services and agencies They match job seekers with advertised job vacancies and provide advice on job search activities
import export manager in perfume and cosmetics,Import export managers in perfume and cosmetics install and maintain procedures for crossborder business coordinating internal and external parties
scopist,Scopists edit the transcripts created by court reporters in order to make of them a readable professional legal document They listen or read to the reports given to them in order to apply punctuation missing words format and improve the accuracy of the document
solar energy engineer,Solar energy engineers design systems which generate electrical energy from sunlight such as photovoltaic systems They design and construct systems which optimise the energy output from solar power and the sustainability of the production process of solar systems
rolling stock inspector,Rolling stock inspectors inspect wagons and carriages to asses their technical condition while grouped together and before they are used for transportation activities They check technical devices ensure complete and correct operation of the rolling stock and prepare required technical documents andor checklists Depending on work organisation they are also responsible for limited adhoc maintenance or exchange work and the performance of brake tests
drawing artist,Drawing artists express concepts by providing a drawn representation corresponding to the idea
chimney sweep supervisor,Chimney sweep supervisors oversee and coordinate the activities of chimney sweeps They do quality checks and ensure compliance with safety regulations
"import export manager in coffee, tea, cocoa and spices",Import export managers in coffee tea cocoa and spices install and maintain procedures for crossborder business coordinating internal and external parties
planer thicknesser operator,Planer thicknesser operators use machinery to shave wood planks to a uniform thickness The machine usually planes both sides of the plank in one operation They feed the plank into the machine carefully to prevent excess planing at the edge known as snipe
optical instrument production supervisor,Optical instrument production supervisors coordinate plan and direct the optical instrument production process They make sure the optical glass is processed properly and optical equipment is assembled according to specifications They manage labourers working on the production line oversee the quality of the assembled goods and perform cost and resource management
road roller operator,Road roller operators work with equipment to compact a variety of materials such as soil gravel concrete or asphalt in the construction of roads and foundations They walk behind or sit on top of the road roller depending on the type and size and roll over the area to be compacted
dairy products maker,Dairy products makers artisanally process raw milk to make dairy products such as butter cheese cream and milk
hydrographic surveyor,Hydrographic surveyors measure and map by means of specialised equipment marine environments They collect scientific data in order to study the underwater topography and morphology of bodies of water
auger press operator,Auger press operators control and adjust an augerpress in order to perform clay forming extrusion and cutting operations on products according to specifications
healthcare inspector,Healthcare inspectors visit healthcare facilities to ensure proper care is given to all patients in accordance with legal requirements They also inspect if equipment processes and staff operate adequately to prevent the spreading of infections and diseases
battery test technician,Battery test technicians use positive and negative wired plugs to test batterys resistance capacity They also test rejected batteries to determine their flaws
doorman/doorwoman,Doormendoorwomen welcome guests to a hospitality establishment and provide additional services related to assistance with luggage guests safety whilst ensuring security
behavioural scientist,Behavioural scientists research observe and describe human behaviour in society They draw conclusions on the motives that stir actions in humans observe the various circumstances for different behaviours and describe different personalities They advise organisations and governmental institutions on this field They may also analyse the behaviour of animals
automotive engineering technician,Automotive engineering technicians work with automotive engineers to operate repair maintain and test equipment used in motor vehicles In some environments such as an airport they are responsible for keeping equipment and vehicles serviceable They review blueprints and designs to determine test specifications and procedures Automotive engineering technicians use software to make sure that parts of a motor vehicle are functioning properly They record test procedures and results and make recommendations for changes
land planner,Land planners visit sites in order to create projects and plans for land usage and development They collect and analyse data about the land Land planners provide advice on the efficiency and safety of development plans
glass polisher,Glass polishers finish plate glass to make a variety of glass products They polish the edges of the glass using grinding and polishing wheels and spray solutions on glass or operate vacuum coating machines to provide a mirrored surface
"agricultural raw materials, seeds and animal feeds distribution manager",Agricultural raw materials seeds and animal feeds distribution managers plan the distribution of agricultural raw materials seeds and animal feeds to various points of sales
wood drying kiln operator,Wood drying kiln operators control the process of applying heat to moist or green wood in order to obtain usable dry wood Depending on the type of kiln the drying operator will be responsible for moving the wood into and out of the kiln temperature control and ventilation
laundry and dry cleaning manager,Laundry and dry cleaning managers oversee the laundry operations in an institutional laundry They supervise laundry and dry cleaning staff plan and enforce safety procedures order supplies and oversee the laundrys budget Laundry and dry cleaning managers ensure the quality standards and that customers expectations are met
budget manager,Budget managers assess financial proposals of different departments before granting financial resources to projects They monitor the implementation of budget policies and procedures They work closely with other departments in the evaluation of programs their impact in the organisation the revenue that they can yield and the financial efforts required
airside safety manager,"Airside safety managers supervise the airside operations safety and security and advise the civil aviation authorities on the airport information systems changes They write safety analysis reports ensure compliance with standards and regulations and  improve the airside safety procedures

"
cargo vehicle driver,Cargo vehicle drivers operate vehicles such as trucks and vans They may also take care of the loading and unloading of cargo
music arranger,Music arrangers create arrangements for music after its creation by a composer They interpret adapt or rework a composition for other instruments or voices or to another style Music arrangers are experts in instruments and orchestration harmony polyphony and composition techniques
dewatering technician,Dewatering technicians install and operate pumps spares pipe ranges and vacuum dewatering systems to collect and remove liquids and chemicals
ICT capacity planner,ICT capacity planners ensure that the capacity of ICT services and ICT infrastructure is able to deliver agreed service level targets in a cost effective and timely manner They also consider all resources required to deliver the appropriate ICT service and plan for short medium and long term business requirements
metallurgical manager,Metallurgical managers coordinate and implement short and medium term metallurgical or steelmaking production schedules and coordinate the development support and improvement of steelmaking processes and the reliability efforts of the maintenance and engineering departments They also partner with ongoing remediation initiatives
farm manager,Farm managers plan and organise the daily operations resourcing and business management of animal producing farms
air traffic instructor,Air traffic instructors train people in all the matters regarding with the operations in air navigation services such as the management of flight traffic and the communication for navigation in aerodromes They teach all the directives issued by air traffic control for the purpose of passing to trainees the sense of safety and expeditious flow of air traffic
plastic and rubber products manufacturing supervisor,Plastic and rubber products manufacturing supervisors manage and coordinate the activities of personnel involved in plastic or rubber products manufacturing making sure the production is efficiently safely and costeffectively processed They are responsible for the installation of new production lines and for the provision of trainings
