aircraft engine tester,Aircraft engine testers test the performance of all engines used for aircraft in specialised facilities such as laboratoriesThey position or give directions to workers positioning engines on the test stand They use hand tools and machinery to position and connect the engine to the test stand They use computerised equipment to enter read and record test data such as temperature speed fuel consumption oil and exhaust pressure
mobile devices technician,Mobile devices technicians carry out proper fault diagnosis to improve the quality of mobile devices and repair them They provide information related to a number of services including warranties and aftersale services
mine ventilation engineer,Mine ventilation engineers design and manage systems and equipment to ensure fresh air supply and air circulation in underground mines and the timely removal of noxious gases They coordinate ventilation system design with mine management mine safety engineer and mine planning engineer
hazardous materials inspector,Hazardous materials inspectors inspect facilities which handle hazardous materials to ensure compliance to health and safety regulations and hazardous materials handling legislation They investigate violations oversee tests of emergency and risk response plans and consult on the improvement of the facilities operations and procedures as well as on hazardous materials regulations They also advise plants on potential sources of danger to a community and on better safety regulations
railway station manager,Railway station managers are in charge of organising tasks linked to the operation of train stations Their tasks cover the organisation of the maintenance and repairment works for buildings and interior equipment They care for the comfort service safety and security of passengers other clients and the commercial use of buildings Depending on the size of the station the number of staff that railway station managers are directly responsible for can be high
flight instructor,Flight instructors train both new and experienced pilots seeking to gain licences or experience in flying new aircraft how to properly operate an aircraft according to regulations They teach their students both the theory and practice of how to optimally fly and maintain an airplane and they observe and evaluate student technique They also focus on the regulations relating to operational and safety procedures specific to different commercial airline aircraft
costume maker,"Costume makers construct sew stitch dye adapt and maintain costumes to be used in live performances and in movies or television programs Their work is based on artistic vision sketches or finished patterns combined with knowledge of the human body to ensure the wearer maximum range of movement They work in close cooperation with the designers 
 "
carpet weaver,Carpet weavers operate machinery to create textile floor coverings They create carpets and rugs from wool or synthetic textiles using specialised equipment Carpet weavers can use diverse methods such as weaving knotting or tufting to create carpets of different styles
credit risk analyst,Credit risk analysts manage individual credit risk and care for fraud prevention business deal analysis legal documents analysis and recommendations on the level of the risk
tax policy analyst,Tax policy analysts research and develop taxation policies and legislation in order to improve and develop tax policies They advise official bodies on policy implementation and financial operations as well as forecast financial influence of changes in tax policies
healthcare specialist lecturer,Healthcare specialist lecturers are subject professors teachers or lecturers and often doctors who instruct students who have obtained an upper secondary education diploma in their own specialised field of healthcare which is predominantly academic in nature They work with their university research assistants and university teaching assistants for the preparation of lectures and of exams for grading papers and exams for leading laboratory practices and for leading review and feedback sessions for the students They also conduct academic research in their respective field of specialist healthcare publish their findings and liaise with other university colleagues
facilities manager,Facilities managers perform strategic planning as well as routine operational planning related to buildings administration and maintenance They control and manage health and safety procedures supervise the work of contractors plan and handle buildings maintenance operations fire safety and security issues oversee buildings cleaning activities utilities infrastructure and are in charge of space management
title closer,Title closers handle and investigate all documentation needed for a property sale including the contracts settlement statements mortgages title insurance policies etc They ensure compliance with legal requirements and review all the fees related to the real estate sales process
food grader,Food graders inspect sort and grade food products They grade food products according to sensory criteria or with the help of machinery They determine the products use by grading them into the appropriate classes and discarding damaged or expired foods Food graders measure and weigh the products and report their findings so the food can be further processed
court enforcement officer,Court enforcement officers enforce orders of court judgements such as managing the recovery of money owed seizing of goods and selling goods in public auctions to obtain the money owed They also send summons and arrest warrants to ensure attendance in court or other judicial procedures
guide,"
Guides assist individuals or groups on any art facility travel or sightseeing tours or through places of touristic interest such as museums monuments and public places They help people to interpret the cultural heritage of an object place or area and provide information and guidance"
office equipment repair technician,Office equipment repair technicians provide services to businesses related to installing maintaining and repairing new or existing equipment such as printers scanners and modems on the clients premises They keep records of performed services and return equipment to a repair centre if needed
import export manager in live animals,Import export managers in live animals install and maintain procedures for crossborder business coordinating internal and external parties
airline food service worker,Airline food service workers prepare food and serve customers They prepare simple dishes to be used in places that serve food such restaurants cafetarias hotels hospitals and ensure that kitchen operations run smoothly and efficiently
roofer,Roofers cover structures with roofs They install the weightbearing elements of a roof either flat or pitched then cover it with a weatherproof layer
motion picture film developer,Motion picture film developers develop film material into visible videos and material They develop the footage into different formats such as 6570mm and 8mm and presentations such as black and white and colour They work small cinefilms per request of clients
pile driving hammer operator,Pile driving hammer operators work with a piece of heavy equipment that positions piles and hammers them into the ground using a rigging mechanism
cattle breeder,Cattle breeders oversee the production and daytoday care of cattle They maintain the health and welfare of cattle
motor vehicle engine tester,Motor vehicle engine testers test the performance of diesel petrol gas and electric engines in specialised facilities such as laboratories They position or give directions to workers positioning engines on the test stand They use hand tools and machinery to position and connect the engine to the test stand They use computerised equipment to enter read and record test data such as temperature speed fuel consumption oil and exhaust pressure
"import export specialist in machinery, industrial equipment, ships and aircraft",Import export specialists in machinery industrial equiment ships and aircraft have and apply deep knowledge of import and export goods including customs clearance and documentation
advertising media planner,Advertising media planners advise on the best communication media platforms to convey ideas They analyse advertising plans in order to assess the aim and objective of the marketing strategy They assess the potential and response rate that different communication channels might have on the transmission of a message related to a product company or brand
membranophone musical instruments maker,Membranophone musical instruments makers create and assemble parts to make membranophone instruments to specified instructions or diagrams They stretch and attach the membrane to the frame of the instrument test the quality and inspect the finished instrument
first aid instructor,First aid instructors teach students immediate lifesaving emergency measures such as cardiopulmonary resuscitation the recovery position and injury care They provided practice materials such as a specialised manikin
stevedore,Stevedores sort handle load and unload freight into overtheroad equipment in accordance with oral and written instructions as well as state regulations They move freight such as boxes bulky items or even large pallets of goods to and from storage areas and onto transport vehicles
surface mine plant operator,Surface mine plant operators control heavyduty equipment such as excavators and dump trucks often involving a high level of spatial awareness to excavate load and transport ore raw mineral including sand stone and clay and overburden at quarries and surface mines
immunologist,Immunologists research the immune system of living organisms eg human body and the way it reacts to external infections or invasive harmful agents eg virus bacteria parasites They focus their study on those diseases that affect the immunology of living organisms in order to classify them for treatment
environmental policy officer,Environmental policy officers research analyse develop and implement policies related to the environment They give expert advice to entities such as commercial organisations government agencies and land developers Environmental policy officers work on reducing the impact of industrial commercial and agricultural activities on the environment
tour operator representative,Tour operator representatives act on behalf of the tour operator to give practical information provide assistance handle services and sell excursions to tourists while at their destinations
avionics inspector,Avionics inspectors inspect instruments electrical mechanical and electronic systems of aircrafts to ensure their compliance with the performance and safety standards They also examine maintenance repair and overhaul work and review any modification to check its conformity to standards and procedures They provide detailed inspection certification and repair records
process engineer,Process engineers apply engineering concepts in order to improve all kinds of production and manufacturing processes in terms of efficiency and productivity They evaluate the variables and constraints present in given processes and present engineering solutions to optimise them
motorcycle delivery person,Motorcycle delivery persons perform the transportation of all kinds of packets containing objects loose pieces prepared meals medications and documents that require special treatment in terms of urgency value or fragility They transport and deliver their packets by motorcycle
wood factory manager,Wood factory managers realise planning commercial and advisory tasks of wood factory and timber trade They also manage purchasing sales customer service and marketing of wood and wood products
law lecturer,"Law lecturers are subject professors teachers or lecturers who instruct students who have obtained an upper secondary education diploma in their own specialised field of study law which is predominantly academic in nature They work with their university research assistants and university teaching assistants 
for the preparation of lectures and of exams for grading papers and exams and for leading review and feedback sessions for the students They also conduct academic research in their respective field of law publish their findings and liaise with other university colleagues"
broadcast news editor,Broadcast news editors decide which news stories will be covered during the news They assign journalists to each item Broadcast news editors also determine the length of coverage for each news item and where it will be featured during the broadcast
craft shop manager,Craft shop managers are responsible for activities and staff in specialised shops that sell equipment and supplies for craft activities such as sewing painting or pottery making They manage employees monitor the sales of the store manage budgets and order supplies when a product is out of supply and perform administrative duties if required
tobacco specialised seller,Tobacco specialised sellers sell tobacco products in specialised shops
bank treasurer,Bank treasurers oversee all aspects of the financial management of a bank They manage the liquidity and solvency of the bank They manage and present current budgets revise financial forecasts prepare accounts for audit manage the banks accounts and maintain accurate recordkeeping of financial documentation
milk heat treatment process operator,Milk heat treatment process operators use equipments to perform different methods of pasteurisation andor sterilisation to dairy liquid products They operate equipment such as raw product booster pumps homogenisers flavour control equipment clarifiers separators auxiliary pumps and filters
brick and tile caster,Brick and tile casters operate and maintain mixing machines used in brick and tile products development
early years special educational needs teacher,Early years special educational needs teachers provide speciallydesigned instruction to students with a variety of disabilities on a kindergarten level and ensure they reach their learning potential Some early years special educational needs teachers work with children who have mild to moderate disabilities implementing a modified curriculum to fit each students specific needs Other early years special educational needs teachers assist and instruct students with intellectual disabilities and autism focusing on teaching them basic literacy and life skills All teachers assess the students progress taking into account their strengths and weaknesses and communicate their findings to parents counselors administrators and other parties involved
circus arts teacher,Circus arts teachers instruct students in a recreational context in the various circus techniques and acts such as trapeze acts juggling mime acrobatics hooping tightrope walking object manipulation unicycling tricks etc They provide students with a notion of circus history and repertoire but mainly focus on a practicebased approach in their courses in which they assist students in experimenting with and mastering different circus techniques styles and acts and encourage them to develop their own style They cast direct and produce circus performances and coordinate the technical production and possible set props and costume usage on stage
technical sales representative in machinery and industrial equipment,Technical sales representatives in machinery and industrial equipment act for a business to sell its merchandise while providing technical insight for customers
epidemiologist,Epidemiologists centre their research on origin and causes for illness eruption in humans They determine the way in which diseases are spread out and propose risk preventive measures to health policy organisms
social work supervisor,Social work supervisors manage social work cases by investigating alleged neglect or abuse cases They make family dynamics assessment and provide assistance to sick people or with emotional or mental disorders They train assist advise evaluate and assign work to subordinate social workers making sure that all work is done according to the established policies laws procedures and priorities
perfume and cosmetics distribution manager,Perfume and cosmetics distribution managers plan the distribution of perfume and cosmetics to various points of sales
youth worker,Youth workers assist and counsel young people helping them to reach their full potential by facilitating their personal social and educational growth They are also involved in managing youth and community projects and resources delivering programmes related with health relationships smoking drugs or violence issues Youth workers advocate young peoples interests and collaborate with other organizations that support young people
business developer,"
Business developers strive to improve the market share of companies in the market They perform strategic analyses of the core advantages that a companys products or services have to offer they cooperate in the development of marketing campaigns for lead generation and support on sales efforts"
supermarket manager,Supermarket managers are responsible for activities and staff in a supermarket
"import export specialist in  fish, crustaceans and molluscs",Import export specialists in fish crustaceans and molluscs have and apply deep knowledge of import and export goods including customs clearance and documentation
seismologist,Seismologists study the movement of tectonic plaques in the Earth which causes the propagation of seismic waves and earthquakes They study and observe the various sources causing earthquakes such as volcanic activity atmospheric phenomena or the behaviour of oceans They provide their scientific observations to prevent dangers in construction and infrastructure
computer hardware repair technician,Computer hardware repair technicians install examine test and repair computer hardware and peripheral components They test computers functionality identify the problems and replace damaged components and parts
biomedical scientist advanced,Biomedical scientists advanced undertake advanced translational research in the biomedical science field and perform as educators of their professions or as other professionals
customer contact centre information clerk,Customer contact centre information clerks provide information to customers via the telephone and other media such as email They answer inquiries about a companys or oganisations services products and policies
investment analyst,Investment analysts undertake research to make informed recommendations to fund managers They research investments globally but depending on the nature and field of their employer they can specialise in fields like retail infrastructure energy banking and financial services  They focus on financial and economical information such as the political and economic developments that can impact financial markets the financial performance of the target companies and use the interpretation of data from different sources to understand how it affects investment decision making
foreign exchange cashier,Foreign exchange cashiers process cash transactions from clients in national and foreign currencies They provide information on the conditions and exchange rates for buying and selling foreign currencies make deposits of money record all foreign exchange transactions and check for money validity
firefighter instructor,Firefighter instructors train probationary new academy recruits or cadets on the theory and practice necessary to become a firefighter They conduct theoretical lectures on academic subjects such as law basic chemistry safety regulations risk management fire prevention reading blueprints etc Fire academy instructors also provide more handson practical instruction regarding the usage of assistive equipment and rescue tools such as a fire hose fire axe smoke mask etc but also heavy physical training breathing techniques first aid self defense tactics and vehicle operations They also prepare and develop lesson plans and new training programmes as new public servicerelated regulations and issues arise The instructors monitor the students progress evaluate them individually and prepare performance evaluation reports
colonel,Colonels serve in the staff of a military commander and function as primary advisers in operational and strategic decisionmaking to senior officers
arboriculturist,Arboriculturists carry out specialised tasks related to observation health and maintenance of trees
columnist,Columnists research and write opinion pieces about news events for newspapers journals magazines and other media They have an area of interest and can be recognised by their writing style
import export manager,Import export managers install and maintain procedures for crossborder business coordinating internal and external parties
spokesperson,Spokespeople speak on behalf of companies or organisations They use communication strategies to represent clients through public announcements and conferences They promote their clients in a positive light and work to increase an understanding of their activities and interests
casino pit boss,Casino pit bosses support the management team and are able to manage inspect and deal with all gaming activities They supervise the gaming floor operation and are accountable for influencing the spend and income per head to achieve the required margin whilst ensuring that the highest standards of efficiency security and signature service standards are achieved in accordance with all company procedures and current legislation
civil enforcement officer,Civil enforcement officers patrol the streets to enforce parking restrictions ensure a free flow of traffic is maintained ensure the safety of pedestrians and ensure traffic and parking laws are complied with They aid with the combating of crime and crime reduction by providing assistance during incidents and providing patrol services
automotive brake technician,Automotive brake technicians inspect maintain diagnose and repair braking steering and suspension systems as well as wheels and tyres
animal feed operator,Animal feed operators tend various animal feed processing machines in industrial plants such as mixing machines filling machines and loading machines
property acquisitions manager,"Property acquisitions managers ensure land or property acquisitions transactions They liaise with relevant stakeholders concerning financial aspects and risks arising from the acquisition of property Property acquisitions managers ensure compliance with legal requirements for purchasing property and take care of all documentation and closure techniques needed
"
material stress analyst,Material stress analysts plan and use software to perform structural analyses including static stability and fatigue analyses on a variety of machines They develop analysis of primary and secondary structures They prepare technical reports to document their analysis results participate in design reviews and recommend process improvements They also assist in the development of structural test plans
wholesale merchant in metals and metal ores,Wholesale merchants in metals and metal ores investigate potential wholesale buyers and suppliers and match their needs They conclude trades involving large quantities of goods
investment fund manager,Investment fund managers implement and monitor the investment strategy of a fund They manage the funds portfolio trading activities and supervise the financial securities and investment analysts in charge to perform research on the investments and then make buying and selling recommendations They make decisions on when to buy or sell the assets included in a portfolio This manager works in a variety of settings such as banks companies and stockbroking companies working closely with the investment analyst This occupation manages strategy and does not always work with relations between shareholders or investors
property developer,Property developers buy land finance deals order construction projects and orchestrate the process of development They purchase a tract of land decide on a marketing strategy and develop the building program Developers must also obtain legal approval and financing When the project is finished they may lease manage or sell the property
rental service representative in agricultural machinery and equipment,Rental service representatives in agricultural machinery and equipment are in charge of renting out equipment and determining specific periods of usage They document transactions insurances and payments
road transport maintenance scheduler,Road transport maintenance schedulers are responsible for the effective execution of all maintenance work control processes of vehicles for urban transport and for the efficient and effective use of planning and scheduling all resources to conduct maintenance activities
wine fermenter,Wine fermenters tend tanks to ferment crushed fruit or must into wines They dump specified amounts of crushed fruits into wine tanks and mix them with syrup chemicals or yeast They prevent the growing of bacteria growth during fermentation
mediation and education manager,Mediation and education managers are in charge of all programmes activities studies and research concerning the presentation of the cultural venues artefacts or programme to current and prospective visitors
veneer grader,Veneer graders inspect slices of veneer for quality They look for irregularities blemishes and production errors and grade the slices for the desirability of the patterns
