"heating, ventilation, air conditioning (and refrigeration) service engineer",Heating ventilation air conditioning and refrigeration service engineers install and maintain industrial heating air conditioning and possibly refrigeration systems They set up furnaces thermostats ducts vents and other equipment needed to ensure the controlled passage and treatment of air They also carry out repairs
travel agent,Travel agents design and market travel programme itineraries for potential travellers or visitors
tooling engineer,Tooling engineers design new tools for manufacturing equipment They prepare tooling quotation requests They estimate costs and delivery time manage tooling construction followup and supervise the routine maintenance of tools They also analyse data to determine the cause of major tooling difficulties and develop recommendations and action plans for solutions
licensing manager,Licensing managers oversee licenses and rights of a company regarding use of its products or intellectual property They ensure that third parties comply with specified agreements and contracts and negotiate with and maintain relationships between both parties
tunnel boring machine operator,Tunnel boring machine operators work on large pieces of tunnelling equipment commonly known as TBMs They regulate the operation of the machine adjusting the torque of the rotating cutting wheel and screw conveyor to maximise stability of the tunnel before tunnel rings are installed Tunnel boring machine operators then put the reinforced concrete rings in place using remote controls
prop maker,Prop makers construct build prepare adapt and maintain props used on stage and for filming movies or television programs Props may be simple imitations of real life objects or may include electronic pyrotechnical or other effects Their work is based on artistic vision sketches and plans They work in close cooperation with the designers involved in the production
director of compliance and information security in gambling,Directors of compliance and information security in gambling follow the regulatory compliance for gambling and oversee Information Security to ensure secure and safe use of all information technology associated in gambling
recycling specialist,Recycling specialists research recycling policies and legislation and supervise implementation in an organisation to ensure that waste management occurs according to regulations They perform inspections provide recycling equipment and supervise recycling workers They also advise organisations on ways they can improve their waste management procedures
financial risk analyst,Financial risk analysts correctly identify and review potential risk areas threatening the assets or capital of organisations They specialise in either credit market operational or regulatory risk analysis They use statistical analysis to evaluate risk make recommendations to reduce and control risk and review documentation for legal compliance
welder,"
Welders operate welding equipment in order to join metal workpieces together They can use fusion welding processes based on different techniques and materials They also perform simple visual inspection of welds"
groundwater monitoring technician,Groundwater monitoring technician monitor the environment gathering data in the form of samples and performing tests in a laboratory or field to investigate potential sources of pollution They also perform maintenance tasks on the monitoring equipment
refinery shift manager,Refinery shift managers supervise staff manage plant and equipment optimise production and ensure safety at the oil refinery on a daytoday basis
chief technology officer,Chief technology officers contribute to a companys technical vision and lead all aspects of technology development according to its strategic direction and growth objectives They match technology with business needs
sports programme coordinator,Sports programme coordinators coordinate sports and recreation activities and policy implementation They develop new programs and aim to promote and implement them as well as ensure the maintenance of sports and recreation facilities
pharmacy technician,Pharmacy technicians under the supervision of a pharmacist check incoming goods control stock handle and store pharmaceuticals properly Where permitted by national rules they dispense medication and provide advice on their appropriate use
legislative drafter,Legislative drafters research pieces of legislations and edit them in order to make them stronger and more clear Rarely they also add new ideas which have never been incorporated into a law or a bill before
respiratory therapy technician,Respiratory therapy technicians assist doctors and surgeons to treat respiratory problems They work in hospitals and medical facilities where they operate medical equipment to test patients respiratory conditions and aid in their treatment Respiratory therapy technicians also tend to breathing equipment and machines during surgery
mine planning engineer,Mine planning engineers design future mine layouts capable of achieving production and mine development objectives taking into account the geological characteristics and structure of the mineral resource They prepare production and development schedules and monitor progress against these
gas distribution engineer,Gas distribution engineers design and construct transport systems for natural gas connecting the gas distribution network to the consumer by designing piping works and mains They research methods to ensure sustainability and to decrease environmental impact as well as optimising cost efficiency
insurance risk consultant,Insurance risk consultants prepare reports for insurance underwriters For this purpose they undertake surveys in order to determine the potential financial risk for personal products properties or sites
video artist,Video artists create videos using analogue or digital techniques to obtain special effects animation or other animated visuals using films videos images computer or other electronic tools
leather goods quality technician,Leather goods quality technicians perform tasks related to the quality system by controlling quality executing laboratory tests finished products used materials and components according to the national and international standards They analyse and interpret the result of the laboratory tests prepare reports advise on corrective and preventive measures contributing for the accomplishment of requirements and objectives in the with the aim of continuous improving and the customer satisfaction
pharmacist,Pharmacists prepare dispense and provide prescriptions for over the counter medication They offer clinical information on medicines report suspected adverse reactions and provide personalised support to patients Pharmacists formulate and test medications in laboratories and store preserve and distribute them
road construction supervisor,Road construction supervisors monitor the construction and maintenance of roads They assign tasks and take quick decisions to resolve problems
rolling stock engineer,Rolling stock engineers design and oversee the manufacturing process and installation of rail vehicles including locomotives carriages wagons and multiple units They design new trains and electrical or mechanical parts supervise modifications and resolve technical problems They also perform routine maintenance duties to ensure that trains are in good condition and meet quality and safety standards
pump operator,Pump operators assist firefighting operations by controlling the pumps which supply water and other substances for extinguishing fires They ensure the substance is delivered in the right amount and under the correct  pressure through the firehose
zoo educator,"Zoo educators teach visitors about the animals living at the zooaquarium as well as other species and habitats They provide information about management of zoos its collection of animals and wildlife conservation Zoo educators can be involved in both formal and informal learning opportunities ranging from production of information signs at enclosures to delivering classroom sessions linked to school or university curricula Depending on the size of the organisation the education team may be a single person or a large team Consequently the optional skills reqired are very broad and will vary from organisation to organisation  
 
Zoo educators also promote conservation efforts This can involve work within the zoo but also in the field as part of any zoo outreach projects"
mine control room operator,Mine control room operators perform a range of tasks from the control room of a mine They monitor the processes through electronic representations shown on monitors dials and lights Control room operators make changes to variables and communicate with other departments to make sure processes keep running smoothly and according to established procedures They take appropriate actions in case of irregularities or emergencies
glove maker,Glove makers design and manufacture technical sport or fashion gloves
vehicle cleaner,Vehicle cleaners clean and polish surfaces of external parts and interiors of vehicles
distillery miller," Distillery millers tend distillery mills in order to clean and grind whole grain for use in production of distilled liquors They tend cleaning machines to remove impurities from grains followed by the grinding and weighing of grains They perform daily maintenance on pumps airconveyor chutes and machines 
"
electrical transmission system operator,Electrical transmission system operators transport energy in the form of electrical power They transmit electrical power from generation plants over an interconnected network an electrical grid to electricity distribution stations
animal shelter worker,Animal shelter workers provide animal care routine services at the animal shelter They receive animals brought to the shelter respond to calls about lost or injured animals nurse animals clean cages handle papers for adoption of animals transport animals to the veterinarian and maintain database with the animals present in the shelter
diagnostic radiographer,Diagnostic radiographers plan prepare and perform diagnostic imaging examinations and post processing with a wide range of equipment and techniques using Xrays strong magnetic fields or Magnetic Resonance Imaging MRI and high frequency sound Ultrasound
head of workshop,Heads of workshop coordinate specialised workshops that construct build prepare adapt and maintain elements used on stage Their work is based on artistic vision schedules and overall production documentation They liaise with the designers involved in the production the production team and other services of the organisation
sewing machine operator,Sewing machine operators tend specific sewing machines in the industrial production chain of wearing apparel They perform operations such as joining assembling reinforcing repairing and altering of wearing apparel
aircraft gas turbine engine overhaul technician,Aircraft gas turbine engine overhaul technicians perform overhaul maintenance and repair work on gas turbine engines They disassemble inspect clean repair and reassemble the engines using enginespecific tooling
interpretation agency manager,Interpretation agency managers oversee operations in the delivery of interpretation services They coordinate the efforts of a team of interpreters who understand and convert spoken communication from one language to another They ensure the quality of the service and the administration of the interpretation agency
food safety inspector,Food safety inspectors carry out inspections in food processing environments from a food safety standpoint They are part of official control bodies who check and control food products and processes to ensure compliance with regulations and laws governing safety and health
metalworking lathe operator,Metalworking lathe operators set up and tend a metalworking lathe manually which is responsible for cutting metal to its desired size and shape by usage of a gear train or a swapping gear that propels the main leadscrew at a variable speed ratio thus rotating the metal workpiece on its axis facilitating the cutting process They check the lathe equipment for wear and handle the metal workpieces as they have been cut by the lathe
leather finishing operator,Leather finishing operators use machines for finishing leather according to the required specifications by the client for surface characteristics such as colour nuance quality pattern and special properties such as waterproofness antiflame retardance antifogging of the leather They arrange the dosage of finishing mixes to apply to the leather and do the routine maintenance of the machinery
"import export manager in computers, computer peripheral equipment and software",Import export managers in computers computer peripheral equipment and software install and maintain procedures for crossborder business coordinating internal and external parties
polygraph examiner,Polygraph examiners prepare individuals for polygraph testing conduct the polygraph exam and interpret the results They pay close attention to detail and use a range of instruments to monitor respiratory sweat and cardiovascular responses to questions addressed during the process Polygraph examiners write reports on the basis of the results and can provide courtroom testimony
animal behaviourist,Animal behaviourists work with animals and people to study observe assess and understand animal behaviour in relation to specific factors and to prevent or address inappropriate or problematic behaviours within individual animals through the development of suitable environments and management regimes in accordance with national legislation 
metal production supervisor,Metal production supervisors oversee the daytoday working process and activities of the labourers in a metal fabrication factory They supervise staff create work schedules maintain a safe work environment and serve as the first most accessible management representative for the workers to contact when there is need
beverage filtration technician,Beverage filtration technicians operate machines that clarify beverages prior to filtering For the purpose they transfer fermented beverages from settling casks into clarifying tanks and spreads chemicals over the surface of beverages to aid their clarification Then they pump beverages to transfer them to filtering tanks
composer,Composers create new music pieces in a variety of styles They usually note down the created music in musical notation Composers may work independently or as part of a group or ensemble Many create pieces to support film television games or live performances
psychology lecturer,Psychology lecturers are subject professors teachers or lecturers who instruct students who have obtained an upper secondary education diploma in their own specialised field of study psychology which is predominantly academic in nature They work with their university research assistants and university teaching assistants for the preparation of lectures and of exams for grading papers and exams and for leading review and feedback sessions for the students They also conduct academic research in their respective field of psychology publish their findings and liaise with other university colleagues
department store manager,Department store managers organise and control the operations and staff of establishments which provide retail services
wood boring machine operator,Wood boring machine operators use milling machines or specialise boring jigs to cut holes in wood workpieces Wood boring differs from routing mainly in that the main movement is into the workpiece as opposed to across its surface
door supervisor,Door supervisors ensure that the people entering public places such as bars restaurants and concert venues are suitable and that they do not represent potential problems They enforce legal regulations by checking individuals legal age to enter a bar manage crowds and emergencies monitor dress codes and handle aggressive and abusive behaviours
meat preparations operator,Meat preparations operators prepare fresh meat with ingredients such as spices herbs or additives in order to make readyforsale meat preparations
real estate investor,Real estate investors buy and sell own real estate such as appartements dwellings land and nonresidential buildings to make a profit They might actively invest in these properties to increase its value by repairing renovating or improving the facilities available Their other tasks may include researching the real estate market prices and undertaking property research
wood products assembler,Wood products assemblers put together products from premade pieces of wood They operate machines often hydraulic that bind the various elements of a product together using joints glue or other fasteners Assemblers put the elements in place operate the machine and look out for problems
postman/postwoman,PostmenPostwomen deliver mails and parcel posts to residences and businesses They perform mail delivery and collect signatures from the recipients They perform other duties in connection with mail services from post offices or related organisations
hydropower technician,Hydropower technicians install and maintain systems in hydropower plants They perform inspections analyse problems and carry out repairs They ensure the turbines operate in compliance with regulations and assist the hydropower engineers in the construction of turbines
music and video shop manager,Music and video shop managers assume responsibility for the activities and staff in specialised shops
broadcasting programme director,Broadcasting programme directors make the programme schedule They decide how much broadcast time a programme gets and when it is aired based on a few factors like ratings viewer demographics etc
microsystem engineer,Microsystem engineers research design develop and supervise the production of microelectromechanical systems MEMS which can be integrated in mechanical optical acoustic and electronic products
physicist,Physicists are scientists who study physical phenomena They focus their research depending on their specialisation which can range from atomic particle physics to the study of phenomena in the universe They apply their findings for the improvement of society by contributing to the development of energy supplies treatment of illness game development cuttingedge equipment and daily use objects
usher,Ushers assist visitors by showing their way in a big building such as a theatre stadium or concert hall They check visitors tickets for authorized access give directions to their seats and answer questions Ushers may take on security monitoring tasks and alert security personnel when required
book-sewing machine operator,Booksewing machine operators tend a machine that stitches paper together to form a volume They check that signatures are inserted the right way and the machine does not jam
aircraft marshaller,Aircraft marshallers signal pilots to assist them in operations such as turning slowing down stopping and shutting down engines They lead aircrafts to their parking stands or to the runway They also indicate directions to the pilots by driving a followme car
water plant technician,Water plant technicians maintain and repair water treatment and supply equipment in a water plant They ensure the provision of clean water by measuring the water quality ensuring it is filtered and treated correctly and maintaining distribution systems
gravure press operator,Gravure press operators work with gravure presses where the image is engraved directly on a roll They set up the press and monitor it during the operation taking care of safety and resolving problems
wholesale merchant in office machinery and equipment,Wholesale merchants in office machinery and equipment investigate potential wholesale buyers and suppliers and match their needs They conclude trades involving large quantities of goods
"hides, skins and leather products distribution manager",Hides skins and leather products distribution managers plan the distribution of hides skins and leather products to various points of sales
speech and language therapist,Speech and language therapists focus on the aetiology assessment diagnosis treatment and prevention of communication and swallowing disorders in people of all ages in order to help them maintain promote improve initiate or recover the ability to communicate both verbally and nonverbally They address the development of language speech vocal and hearing functions and disorders and disabilities in the cranial facial and oral area
wholesale merchant in watches and jewellery,Wholesale merchants in watches and jewellery investigate potential wholesale buyers and suppliers and match their needs They conclude trades involving large quantities of goods
printmaker,Printmakers engrave or etch metal wood rubber or other materials to create images which are transported onto surfaces generally using a printing press Printmakers often use tools such as etchercircuit processors pantograph engravers and silk screen etchers
aquaculture rearing technician,Aquaculture rearing technicians operate in aquatic organisms production They are specialists in the rearing weaning and production of juveniles
dryer attendant," Dryer attendants tend rotary dryers to remove moisture from raw materials or food products in transformation They observe instruments to verify dryer temperature and regulate steam pressure in order to determine if products have the specified moisture content 
"
poultry sexer,Poultry sexers are specialists working in poultry farms determining the sex of the animals to separate the male from the female birds 
co-pilot,Copilots are responsible for assisting captains by monitoring the flight instruments handling radio communications watching for air traffic and taking over for the pilot as needed They adhere to the pilots commands flight plans and regulations and procedures of aviation national authorities companies and airports
assayer,Assayers test and analyse precious metals such as silver and gold to determine the value and properties of components using chemical and physical techniques They also seperate precious metals or other components from other materials
materials handler,Materials handlers execute the handling and storage of materials through activities such as loading unloading and moving articles in a warehouse or storage room They work according to orders to inspect materials and provide documentation for the handling of items Materials handlers also manage inventory and ensure the safe disposal of waste
import export specialist in live animals,Import export specialists in live animals have and apply deep knowledge of import and export goods including customs clearance and documentation
traditional chinese medicine therapist,Traditional Chinese medicine therapists use alternative medicine approaches to cure illnesses in all its forms They also use various therapies such as the use of herbal medicines acupuncture massages and dietary therapies to increase the general health of the patient and to prevent a disease from occurring
rolling stock engine tester,"Rolling stock engine testers test the performance of diesel and electric engines used for locomotives They position or give directions to workers positioning engines on the test stand They use hand tools and machinery to position and connect the engine to the test stand They use computerised equipment to enter read and record test data such as temperature speed fuel consumption oil and exhaust pressure
"
business studies and economics teacher secondary school,Business studies and economics teachers at secondary schools provide education toÂ students commonly children and young adults in aÂ secondary school setting They are usually subject teachers specialised and instructing in their own field of study business and economics They prepare lesson plans and materials monitor the studentsâ progress assist individually when necessary and evaluate the studentsâ knowledge and performance on the subject of business and economicsÂ through assignments tests and examinations
nature conservation officer,Nature conservation officers manage and improve the local environment within all the sectors of a local community They promote awareness of and understanding about the natural environment This work can be very varied and involve projects related to species habitats and communities They educate people and raise overall awareness of environmental issues
leather raw materials purchasing manager,Leather raw materials purchasing managers plan and purchase supplies of hides skins wetblue or crust in coordination with the production requirements They negotiate processes and forecast the levels of demand for products to meet business needs and keep constant check on stock levels and quality to maximise business efficiency They identify potential suppliers visit existing suppliers and develop business relationships with them
art teacher secondary school,Art teachers at secondary schools provide education toÂ students commonly children and young adults in aÂ secondary school setting They are usually subject teachers specialised and instructing in their own field of study art They prepare lesson plans and materials monitor the studentsâ progress assist individually when necessary and evaluate the studentsâ knowledge and performance on the subject of artÂ through assignments tests and examinations
jewellery and watches specialised seller,Jewellery and watches specialised sellers sell maintain and clean jewels and watches in specialised shops
